texto;";";classe
 Curitiba registra manhã mais fria do ano Termômetros marcaram 9,6ºC entre 6h e 7h desta terça-feira. Segundo Inmet, ar seco e poucas nuvens provocaram baixa temperatura.;";";desgosto
 Microsoft anuncia mais cortes dentro do 'pacote' de 5 mil demissões Número representa 5% do total de 96 mil funcionários da companhia. Plano de cortes anunciado em janeiro terá duração de 18 meses.;";";desgosto
 Laboratório confirma que botulismo matou menina de 6 anos em AL Lacen divulgou resultado positivo de testes na manhã desta terça-feira. Uma criança e dois adolescentes continuam internados na UTI.;";";desgosto
 México lança pacote de estímulo econômico de US$ 2 bilhões Objetivo é apoiar setores afetados pela nova gripe. Medidas fiscais totalizam cerca de 17,4 bilhões de pesos.;";";desgosto
 Juiz libera US$ 4,5 bilhões para Chrysler operar Empréstimo dos Estados Unidos e do Canadá será para pagamentos. Credores se posicionaram contra o acesso ao financiamento.;";";desgosto
 Vice de Obama pressiona Israel pela criação do Estado palestino Joe Biden também pediu aos palestinos que interrompam ataques. Governo de Netanyahu reluta em negociar a solução de dois estados.;";";desgosto
 Presidente Lula visita desabrigados pelas enchentes no Piauí Mais cedo, ele havia sobrevoado áreas mais atingidas. Depois, o presidente segue para visitar áreas afetadas no Maranhão.;";";desgosto
 Após morte de menina, duas escolas são interditadas em GO Exames indicaram que garota tinha hepatite. Suspeita é de que água está contaminada.;";";desgosto
 Após assembleia, funcionários da USP decidem por manutenção de greve Funcionários decidiram que a greve será mantida por tempo indeterminado. A decisão foi tomada após assembleia no prédio de História da USP.;";";desgosto
 Romeu Tuma diz que não deixa corregedoria do Senado Afastamento da função foi pedido por alguns senadores. Ex-diretor acusa Tuma de se envolver com fraudes em contratos.;";";desgosto
 Número de vítimas da nova gripe nos EUA sobe a 403 em 38 estados Novos casos são esperados, dizem autoridades sanitárias. Maioria dos quadros não é grave, e ainda há só uma morte.;";";desgosto
 Número de casos de gripe sobe a 1.490, com 30 mortes, diz agência da ONU Balanço anterior da Organização Mundial da Saúde indicava 1.124 casos. Agência não vê sinais de transmissão em nível comunitário na Europa.;";";desgosto
 Gripe pode fazer economia do México crescer 0,5 ponto a menos, diz ministro Arrecadação de impostos deve cair US$ 752 milhões em 2009. Governo promete gastar US$ 1,3 bilhão na recuperação.;";";desgosto
 Acidente entre carretas deixa dois mortos em MT Dois veículos transportavam soja e óleo lubrificante. Segundo a polícia, vítimas morreram após colisão em uma curva.;";";desgosto
 TSE cancela mais de 550 mil títulos de eleitor em todo o país A maior parte dos cancelamentos ocorreu no estado de São Paulo. Quem teve o título cancelado, deve se dirigir a cartório eleitoral.;";";desgosto
 Alemães fazem passeio no interior de intestino tamanho família Modelo do órgão humano em Dresden é considerado o maior da Europa. Objetivo da mostra é ensinar a prevenir doenças intestinais, como câncer.;";";desgosto
 Megainvestidor Warren Buffett vira boneco nos EUA Brinquedos foram distribuídos a torcedores do Omaha Royals. Bilionário também é um dos principais donos do time.;";";desgosto
 Comércio na Cidade do México perde R$ 240 milhões por dia com a gripe Fechamento de cinco dias ameaça micro e pequenas empresas;";";desgosto
 Ataque suicida mata 5 no Paquistão Atentado contra forças de segurança ocorreu próximo a Peshawar. Oito pessoas ficaram feridas.;";";desgosto
 Número de casos da nova gripe sobe a 1.124, diz Organização Mundial da Saúde Balanço anterior da agência da ONU indicava 1.085 casos. Doença já provocou ao menos 25 mortes no México e uma nos EUA.;";";desgosto
 Turquia descarta terrorismo em ataque em casamento Tiros em casamento deixaram 44 mortos. Ministro disse que ataque foi motivado por briga entre famílias.;";";desgosto
 Mexicanos poderão deixar a China após isolamento por suspeita de gripe Mexicanos que desejarem permanecer deverão seguir em quarentena. México anunciou reabertura dos restaurantes e reinício das aulas.;";";desgosto
 Marcha da maconha reúne 2 mil pessoas no Recife, segundo organização Manifestação foi realizada na área histórica da capital pernambucana. Justiça autorizou evento desde que fosse acompanhado pela polícia.;";";desgosto
 Torcida lembra da gripe suína no Maracanã Torcedores do Flamengo foram com máscaras. Estádio recebeu a final do campeonato estadual.;";";desgosto
 Lula lamenta morte de Boal e destaca papel do dramaturgo Ele faleceu no sábado de insuficiência respiratória no Rio de Janeiro. Para presidente, o dramaturgo inspirou gerações.;";";desgosto
 Judeus e homossexuais protestam contra vinda de presidente do Irã Manifestação reuniu cerca de 400 pessoas na região central de SP. Mahmoud Ahmadinejad deve chegar ao Brasil na quarta-feira (6).;";";desgosto
 Número de casos de gripe nos EUA sobe de 160 para 226 Reino Unido também divulgou três novos casos neste domingo (3). Organização Mundial da Saúde conta 19 mortos no México e 1 nos EUA.;";";desgosto
 China isola mexicanos por temor da gripe, diz embaixada Decisão causou crise diplomática entre os dois países. México definiu ação como 'discriminatória e sem fundamento'.;";";desgosto
 Em 12 anos, União banca subsídio de R$ 184 bilhões na dívida de estados Valor supera os orçamentos anuais somados de SP e RJ. Com queda na taxa Selic, estados pressionam por mais concessões.;";";desgosto
 Agricultores e empresas criticam 'monopólio' do BB em crédito rural Programa Mais Alimentos é voltado ao financiamento da agricultura familiar. Concorrência entre bancos favoreceria produtores, dizem.;";";desgosto
 Governo da Colômbia confirma primeiro caso da nova gripe no país Doente é homem de 42 anos que mora próximo à capital. Caso pode ser o primeiro da doença na América do Sul.;";";desgosto
 Colômbia confirma seu primeiro caso da nova gripe, diz imprensa Doente é homem de 42 anos que mora próximo à capital. Caso pode ser o primeiro da doença na América do Sul.;";";desgosto
 Gripe pode atrasar até lançamento de 'Harry Potter' no México Hollywood adiou estreias;";";desgosto
 Andorinhas mudam rotina em cidade paraense Elas chegam a Parauapebas e dão espetáculo no céu. Entretanto, sujeira deixada pelas aves incomoda moradores.;";";desgosto
 Número de casos da gripe suína sobe a 787, com 20 mortes, diz agência da ONU Organização Mundial da Saúde conta 19 mortos no México e 1 nos EUA. Vírus influenza A (H1N1) já atingiu pessoas em pelo menos 17 países.;";";desgosto
 Países mais afetados por gripe pedem que doença não afete comércio Para México, Estados Unidos e Canadá, surto não deve servir de motivo para restrições.;";";desgosto
 Avalanche mata 6 turistas em estação de esqui nos Alpes austríacos Segundo a polícia, mortos eram turistas checos;";";tristeza
 Obama deve se envergonhar por incluir Cuba entre países terroristas, diz Fidel Relatório divulgado na semana passada põe ilha ao lado de Líbia e Sudão. Ex-líder cubano elogiou Obama, mas vê o presidente 'enredado'.;";";desgosto
 Chuvas deixam 10 mortos nas Filipinas Ao menos 15 pessoas estão desaparecidas. Mau tempo fecha portos e provoca colapso na rede elétrica.;";";desgosto
 Chuvas já atingiram cerca de 80 mil pessoas no Ceará Do total, 11.383 estão desalojadas e 5.498 estão desabrigadas. Chuva danificou 1.543 casas e destruiu 461 em todo o estado.;";";desgosto
 Enchentes causam a morte de 4 pessoas em AL Vítimas são mãe, filho, idosa de 100 anos e adolescente. Defesa Civil da capital já registrou mais de 30 ocorrências.;";";desgosto
 Maranhão tem 41 mil desabrigados pela chuva Número de afastados de suas casas aumentou 70% em cinco dias. Governadora Roseana Sarney decretou estado de calamidade pública.;";";desgosto
 Barbosa Neto toma posse como prefeito de Londrina (PR) Ele levantou bandeiras da ética, transparência e responsabilidade. Cidade era administrada interinamente por presidente da Câmara.;";";desgosto
 Berzoini chama empresários que demitem 'sem precisar' de 'ladrões' Presidente do PT participou de festa do Dia do Trabalho da CUT. José Genoíno também participou do evento da central.;";";desgosto
 Vendas de carros despencam nos Estados Unidos Chrysler registrou maior queda (48%) em relação ao mês passado. GM recuou 33%, mas continua líder com 172.150 veículos vendidos.;";";desgosto
 Petróleo atinge nível mais alto em um mês em Nova York Na Nymex, barril para entrega em junho fechou a US$ 53,20. Durante a sessão, o preço do barril chegou a US$ 53,65.;";";desgosto
 Bolívia nacionaliza fornecedora britânica de combustível de aviação AirBP Morales ordenou às Forças Armadas e à YPFB que assumissem o controle. Ele já nacionalizou empresas de petróleo, mineração e comunicações.;";";desgosto
 Washington Post registra perdas de US$ 19,5 milhões no primeiro trimestre Grupo havia registrado lucro de US$ 39,3 milhões no 1º trimestre de 2008. Lucros com publicidade caíram 33% em relação ao ano passado.;";";desgosto
 Temporão diz que chegada de vírus é inevitável, mas sem motivo para pânico Segundo o ministro, o Brasil está preparado para enfrentar a gripe. Fábrica no interior de SP está produzindo máscaras contra a doença.;";";desgosto
 Camundongos atacam idosos em asilo na Austrália Veterano de guerra teve ferimentos no rosto, no pescoço e nas orelhas.;";";desgosto
 PF e Força Nacional começam operação de retirada de não índios da Raposa Prazo para saída de produtores de arroz da área acabou na quinta. Desembargador disse que força só será usada caso haja resistência.;";";desgosto
 Hong Kong confirma e gripe suína chega ao sudeste asiático Grã-Bretanha tem primeiro caso de paciente que não foi ao México. EUA veem casos aumentarem de 109 para 141.;";";desgosto
 Deslizamentos deixam três mortos em AL Em Coqueiro Seco, adolescente dormia em casa atingida por barreira. Mãe e filho foram vítimas da chuva em Maceió.;";";desgosto
 Revista diz que ministro do STF deu acesso privilegiado em voos a parentes 'IstoÉ' afirma que Carlos Alberto Direito beneficiou amigos e parentes. Presidente do STF defendeu colega e descartou abertura de investigação.;";";desgosto
 OMS confirma 331 casos de gripe e dez mortes no mundo Entre os mortos, nove são do México e um dos EUA. Autoridades mexicanas, porém, falam em 12 mortes no país.;";";desgosto
 Colecionar insetos aguça interesse pela ciência, dizem pesquisadores Especialistas questionam leis rígidas que proíbem a prática no Brasil. Coleta de insetos é permitida apenas para fins científicos.;";";desgosto
 Grupo invade igreja, come e leva eletroeletrônicos em MS Pastor disse que ladrões comeram a sobra da festa do Dia dos Namorados. Esta teria sido a terceira vez que o local é assaltado.;";";medo
 Polícia iraniana detém 2 jornalistas belgas durante protestos em Teerã Jornalistas ficaram cerca de uma hora detidos e foram liberados. Além deles, mais de cem manifestantes e opositores também foram detidos.;";";medo
 PF prende 31 em operação contra tráfico de drogas no Piauí Segundo o delegado, quadrilha agia em outros estados do Nordeste. Policiais apreenderam drogas, armas, veículos e computadores.;";";medo
 Vacina contra tuberculose é perigosa demais para bebês com vírus da Aids Conclusão é de estudo feito pela OMS na África do Sul, onde HIV é comum. Imunização não só não traz proteção como pode matar criança.;";";medo
 Mais de 8 mil empresas japonesas quebraram no primeiro semestre do ano Somente em junho, 1.422 companhias quebraram, segundo pesquisa. Japão sofre com recessão.;";";medo
 União Europeia detecta 237 novos casos da nova gripe em 24 horas Reino Unido é o local mais afetado, com 200 novos contágios. Total de pessoas doentes na Europa é de 2.096.;";";medo
 Manifestantes fazem ato contra reunião do G8 na Itália Ministros das finanças das 7 maiores economias e Rússia têm reunião. Manifestantes distribuem euros falsos em Lecce neste sábado (13).;";";medo
 Jornalista que ficou presa no Irã encontra Hillary em Washington Roxana Saberi, que foi Miss Dakota do Norte, foi acusada de espionagem. Após protestos, sua pena foi diminuída, ela foi libertada e voltou aos EUA.;";";medo
 Peixe alucinógeno é encontrado na Grã-Bretanha Consumo de cabeça da espécie mediterrânea de peixe pode provocar alucinações.;";";medo
 Ministério da Saúde registra mais quatro casos da nova gripe no país Um paciente foi diagnosticado no DF e outros três em São Paulo. Com anúncio, número de infectados no Brasil sobe para 58.;";";medo
 Lula sanciona lei que assegura direitos a gestantes e mães que cumprem pena Lei prevê assistência médica pré e pós-natal em penitenciárias femininas. Estabelecimentos devem também providenciar creches e berçários.;";";medo
 Confira os números sorteados da Mega-Sena Caixa ainda não informou se houve vencedores. Prêmio do concurso 1.077 é de R$ 30 milhões.;";";medo
 Barragem no Piauí transborda pela primeira vez Norte do Piauí sofre com maior volume de chuva dos últimos 40 anos. Força da água cortou estrada e abriu cratera de mais de 1 quilômetro.;";";medo
 Trânsito fica cada vez complicado nas grandes cidades Em São Paulo, estimativa é que trânsito pare em quatro anos. Pesquisa avaliou ainda Rio de Janeiro, Belo Horizonte e Porto Alegre.;";";medo
 Frio faz gripe suína se espalhar por países vizinhos ao Brasil Chile registra mais de mil casos da doença;";";medo
 Vida sexual movimentada torna bactéria mais resistente a antibiótico Pesquisa foi feita com pneumococo, que causa 1 milhão de mortes por ano. Bactérias com genes de resistência trocam DNA com espécies diferentes.;";";medo
 Cientistas estudam como uma gripe tranquila pode se tornar brutal Pandemia de gripe suína se mostrou menos perigosa do que se temia. Entretanto, com o tempo, vírus pode se tornar mais ameaçador.;";";medo
 Terra pode vir a colidir com outro planeta no futuro, alerta simulação Dupla usou supercomputador para simular futuro do Sistema Solar. Chance de 'bagunça' é de 1% nos próximos 5 bilhões de anos.;";";medo
 Zoológico em MG abre as portas em noites de lua cheia Visitantes podem conhecer hábitos noturnos de vários animais. Passeios noturnos são feitos mensalmente no zoológico de Belo Horizonte.;";";medo
 Mamífero que bota ovos da Nova Guiné intriga os cientistas Animal é um dos mamíferos mais antigos e tímidos do mundo. Pesquisador se dedica a desvendar mistérios dessa criatura.;";";medo
 Música ajuda desenvolvimento de bebês prematuros, diz estudo Pesquisa canadense sugere que música reduz dores e estimula alimentação oral.;";";medo
 Defeito em gene pode estar por trás da perda de cabelo, diz estudo Pesquisadores japoneses estudaram processo em camundongos. Principal função de trecho de DNA é 'ancorar' fios no couro cabeludo.;";";medo
 Painel americano recomenda mudança de remédios contra dor para idosos Altas quantidades de aspirina ou paracetamol poderiam trazer perigo. Especialistas sugerem que opioides são alternativa para dor crônica.;";";medo
 Estudo nos EUA liga vírus comum a pressão alta Pesquisadores preveem criação de vacina contra o vírus CMV, que causaria endurecimento das artérias.;";";medo
 G8 perdeu representatividade para países emergentes, diz Amorim 'Não sei como ele vai ser enterrado, mas o G8 morreu', disse chanceler. Celso Amorim participou de debate com Pascal Lamy, da OMC, em Paris.;";";medo
 França perdeu 138 mil empregos em três meses Perda no trimestre foi maior do que em todo o ano passado. Demissões se concentraram nos trabalhos temporários.;";";medo
 Críticos de mudanças na poupança estavam com Collor no confisco, diz Lula 'Tenho muita pena de país que tem oposição que perdeu o discurso' disse. O presidente afirmou que grandes investidores devem aplicar na produção.;";";medo
 Lula se diz favorável a corte permanente do IPI para carros Ele disse que Dilma, se eleita, não abandonará pilares do governo atual. Presidente concedeu entrevista exclusiva à agência de notícias Reuters.;";";medo
 Morre o radialista e ex-deputado Raul Brunini Jornalista lutava contra um câncer e teve falência múltipla dos órgãos. Brunini foi deputado e secretário de Estado do governo Carlos Lacerda.;";";medo
 Estudo prevê que Brasil perderá participação no comércio mundial Projeções até 2030 indicam queda nas vendas externas de produtos manufaturados.;";";medo
 Falsa bomba é abandonada no centro de Belo Horizonte Polícia foi chamada por pessoa que viu artefato em cabine telefônica. Interdição de ruas em horário de pico provocou confusão no trânsito.;";";medo
 Chuva faz Teresina suspender aulas na rede pública Governador orienta outros prefeitos a adotarem medida. Defesa Civil do estado diz que 21 cidades decretaram emergência.;";";medo
 China confirma 25 canadenses em quarentena por conta da nova gripe Estudantes estão sob observação na cidade de Changchun. Autoridades dizem que é legal, mas governo do Canadá pediu explicações.;";";medo
 Batalhão amotina-se na Geórgia, mas governo vê situação sob controle Levante ocorreu no quartel de Mujrovani, próximo a Gori. Pouco antes, governo anunciou ter debelado tentativa de golpe.;";";medo
 Casos da nova gripe chegam a 898 em 18 países, diz OMS Número de mortos permanece 20, segundo entidade. México e EUA seguem como principais focos do vírus.;";";medo
 Marinha francesa captura 11 piratas na costa da Somália Eles estavam em duas lanchas, armados com fuzis e um lança-foguetes. Piratas confundiram a fragata francesa com um navio mercante.;";";medo
 Colombianos marcham contra desemprego, reeleição de Uribe e violência Vários jovens apedrejaram carros da polícia. Manifestação aconteceu em Bogotá.;";";medo
 Dia do Trabalho em Portugal tem agressão e falsa ameaça de bomba Candidato a eleição europeia foi empurrado e insultado. Encontro de confederação geral de trabalhadores teve tumulto.;";";medo
 Gripe suína faz diretoria da Petrobras desistir de evento de petróleo nos EUA Offshore Technology Conference é realizada em Houston, Texas. Brasileira teria espaço especial neste ano, pela descoberta do pré-sal.;";";medo
 Bombeiros tentam resgatar idosa soterrada em AL Casa em que ela estava foi atingida por queda de barreira. Mãe e filho morreram após deslizamento nesta manhã.;";";medo
 Dia do Trabalho é marcado por protestos pelo mundo Na Alemanha e Turquia, houve confrontos com a polícia. No México, sindicatos tiveram que suspender ações por conta da doença.;";";medo
 Veja as principais notícias de abril OMS eleva nível de alerta de pandemia de gripe suína de 4 para 5. Navegue pela galeria de fotos e confira os fatos mais marcantes.;";";medo
 Conselho de Ética rejeita até pena branda contra o deputado do castelo Na semana passada, cassação do deputado Edmar Moreira foi rejeitada. Nesta quarta, parlamentares decidiram que não cabe nem pena mais leve.;";";raiva
 PF investiga despejo de lixo vindo da Europa nos portos do Brasil Toneladas de sujeira desembarcaram escondidas em contêineres. Cinco empresas foram multadas pelo Ibama.;";";raiva
 Site da bolsa de Nova York sofre ataque de hackers Criminosos sobrecarregaram servidores da NYSE Euronext. Segundo operadora, ataque não afetou sistemas de negociação.;";";raiva
 Dois aposentados são agredidos enquanto dormiam na Paraíba Agressores invadiram casa e surpreenderam idosos com socos e tiros. Grupo fugiu sem roubar nada;";";raiva
 Navio encalha na Turquia Acidente ocorreu no Estreito de Bósforo, em Istambul. Não há informação sobre feridos.;";";raiva
 Malásia pode proibir maridos de chamarem mulheres de 'feias' Proposta de emenda constitucional prevê proteção contra violência doméstica 'emocional'.;";";raiva
 Mais um motor de avião que caiu na Bahia chega a São Paulo Hélices e motores serão analisados por técnicos em São José dos Campos. Avião de pequeno porte caiu perto da pista de um resort, em Trancoso.;";";raiva
 Defesa de Mohammed pede condenação com pena branda para crime 'brutal' Advogado George Hidasi alega que réu é semi-imputável por psicopatia. Ele disse que tem vontade de estrangular o cliente pelo crime cometido.;";";raiva
 Médicos tentam explicar origens das cãibras noturnas Episódios são comuns, sobretudo em pessoas mais velhas. Múltiplas causas podem estar ligadas ao fenômeno.;";";raiva
 Astrônomos conseguem flagrar explosão de supernova 'secreta' Fenômeno aconteceu na galáxia M82, a 12 milhões de anos-luz daqui. Nuvens de gás encobrem conflagração, mas ondas de rádio passam.;";";raiva
 Idosos lidam melhor com a privação de sono, mostra experimento Pessoas com menos de 29 anos acabam perdendo dos com mais de 65. Cochilo involuntário não é natural da velhice e pode ser sinal de problema.;";";raiva
 Brasileiros caem para 2º em ranking de consumo ambiental Consumo muito grande de carne bovina levou país a perder posição de destaque.;";";raiva
 Foguete decola com satélites europeus de observação Planck e Herschel vão estudar origens do Universo. Sondas alcançarão sua órbita dentro de 60 dias.;";";raiva
 Empresa de parques temáticos Six Flags pede proteção contra falência A empresa opera parques de diversão nos EUA, Canadá e México. Segundo diretor, administração atual herdou dívida de US$ 2,4 bilhões.;";";raiva
 Frigorífico JBS tem prejuízo de R$ 322,7 milhões JBS é maior processadora global de carne bovina. Um ano antes, perda foi de R$ 6,6 milhões.;";";raiva
 Oposição aproveita erro do governo e toma controle da CPI das ONGs Presidente da CPI usou erro regimental para trocar relator. Arthur Virgílio foi indicado par ao lugar de Inácio Arruda.;";";raiva
 Marta Suplicy participa da Parada Gay em São Paulo Ex-prefeita desfilou em trio elétrico pela avenida Paulista. Parada começou pouco após o meio-dia deste domingo (14).;";";raiva
 Incêndio destrói fábrica de isopor em Minas Gerais Fogo atingiu galpões onde eram mantidos material de escritório e isopor. Peritos vão determinar o que provocou as chamas.;";";raiva
 Professor se nega a dar aula para aluno com deficiência auditiva Governo do Paraná abrirá edital para contratar tradutor. Secretaria diz que tem 398 tradutores de Libras na rede.;";";raiva
 Igreja Católica atua por reserva indígena em Roraima Bispo da Diocese de Roraima incentivou briga pela demarcação. Produtores rurais dizem que ele foi responsável pela quebra da harmonia.;";";raiva
 Marca que 'bomba' rápido também some depressa, dizem cientistas Pesquisa chegou à conclusão examinando uso de nomes para bebês. Resultado também parece funcionar para músicos e outras áreas.;";";raiva
 Mulher que perdeu bebê em acidente é condenada por homicídio Libanesa foi sentenciada a pagar indenização por incidente ocorrido em Dubai.;";";raiva
 Pai mantém bebê refém por oito horas em MS Comerciante teria entrado com criança em banheiro. Ele liberou refém e foi detido.;";";raiva
 Infraero regista atrasos em 8,6% dos voos Das 371 operações previstas, 32 atrasaram mais de 30 minutos. Outras 23 foram canceladas.;";";raiva
 Homem mata mulher, fere irmão dela e rende jovem em AL Segundo delegado, criminoso é ex-policial e foi agredido por vizinhos. Jovem foi mantida dentro de casa por cerca de cinco horas.;";";raiva
 Lula diz não ver 'crime' em 'deputado levar a mulher a Brasília' Presidente disse que não é contra o uso das passagens por esposas. Ele inaugurou centro de neurorreabilitação no Rio.;";";raiva
 PRF flagra menina de 12 anos dirigindo picape em rodovia gaúcha Segundo os policiais, jovem estava acompanhada da mãe em São Borja. Carro foi retido e a mãe autuada por deixar um menor de 18 anos dirigir.;";";surpresa
 Sucuri de 8 metros é flagrada após comer uma capivara Cobra virou atração para moradores de São José do Rio Claro (MT). Ela foi encontrada em um riacho perto de uma fazenda na cidade.;";";surpresa
 Dono de restaurante nos EUA se nega a cozinhar 'lagosta amarela' Mutação genética proporciona coloração diferente ao crustáceo. Chance de encontrar animal diferenciado é de uma em 30 milhões.;";";surpresa
 China prepara seu 1º parque erótico ‘Love Land’ terá esculturas gigantes nuas. ‘Terra do amor’ só irá funcionar no período noturno.;";";surpresa
 Pandemia da nova gripe está às portas, mas OMS hesita em fazer declaração Temor da organização da ONU é estimular o pânico generalizado. Surto pandêmico refere-se à transmissão, e não à gravidade da doença.;";";surpresa
 Ave usa 14 'palavras' diferentes para coordenar ataque a predador Gaio-siberiano tem, no total, 'vocabulário' com 25 chamados diferentes. Capacidades são parecidas com as de primatas, diz cientista sueco.;";";surpresa
 Fungos fazem, ao mesmo tempo, papel de heróis e vilões para humanos Capazes de causar doenças, seres também ajudam em várias coisas. Como fermentar o pão sem eles?;";";surpresa
 Japoneses criam macaquinho transgênico que brilha no escuro Sagui ou mico-estrela é espécie de primata comum em todo o Brasil. Interesse é usar animais como modelos para entender doenças humanas.;";";surpresa
